{
  "schema_version": 1,
  "boundary": "dma_to_pwm5_cc",
  "interpretation": "digital_level_only_not_speaker_loudness",
  "backend_build": {"commit": "c1c20d7d86a3006569375bc333cf72494e95eb46", "dirty": false},
  "firmware": {"file": "PicoTetris.bin", "sha256": "0784d80d0d00c9bf86d06e903234bc022db5bda2ff193e17533c65b9c2546e62"},
  "observation_status": "pass",
  "pcm_sha256": "c978c5173c975f841e2b886d5f9af5f71e07fa3f6dc400b0697dc261758bc356",
  "pcm_format": "stereo_s16le_from_pwm8_duty",
  "sample_rate_hz": 48000,
  "channel_count": 2,
  "frame_count": 1000,
  "window_frames": 1024,
  "active_abs_threshold": 512,
  "peak_abs_left": 16577,
  "peak_abs_right": 16577,
  "stream_rms": 11627,
  "max_window_rms": 11627,
  "dc_offset_left": 69,
  "dc_offset_right": 69,
  "active_frame_count": 958,
  "active_frame_ratio_ppm": 958000,
  "rail_sample_count": 0,
  "rail_sample_ratio_ppm": 0,
  "max_consecutive_rail_frames": 0,
  "out_of_range_duty_sample_count": 0,
  "rail_interpretation": "post_quantizer_pwm_rail_usage_not_source_clip_count"
}
